{
  "$schema": "https://json-schema.org/draft/2020-12/schema",
  "$id": "https://streamscape.tv/contracts/oci-build-input-lock.schema.json",
  "title": "StreamScapeTV producer-owned OCI target input lock",
  "type": "object",
  "additionalProperties": false,
  "required": [
    "schema_version",
    "lock_version",
    "product_id",
    "target_id",
    "input_policy_id",
    "platforms",
    "bases",
    "external_inputs"
  ],
  "properties": {
    "schema_version": {
      "const": 1
    },
    "lock_version": {
      "const": "1.0.0"
    },
    "product_id": {
      "$ref": "#/$defs/productId"
    },
    "target_id": {
      "$ref": "#/$defs/safeId"
    },
    "input_policy_id": {
      "$ref": "#/$defs/safeId"
    },
    "platforms": {
      "$ref": "#/$defs/platforms"
    },
    "bases": {
      "type": "array",
      "minItems": 1,
      "maxItems": 64,
      "items": {
        "$ref": "#/$defs/baseLock"
      }
    },
    "external_inputs": {
      "type": "array",
      "maxItems": 64,
      "items": {
        "$ref": "#/$defs/externalInput"
      }
    }
  },
  "$defs": {
    "safeId": {
      "type": "string",
      "pattern": "^[a-z][a-z0-9-]{0,63}$"
    },
    "productId": {
      "type": "string",
      "pattern": "^[a-z0-9]+(?:[._-][a-z0-9]+)*$"
    },
    "sha256": {
      "type": "string",
      "pattern": "^[0-9a-f]{64}$"
    },
    "platform": {
      "type": "string",
      "enum": [
        "linux/amd64",
        "linux/arm64/v8"
      ]
    },
    "platforms": {
      "type": "array",
      "minItems": 1,
      "maxItems": 2,
      "uniqueItems": true,
      "items": {
        "$ref": "#/$defs/platform"
      }
    },
    "relativePath": {
      "type": "string",
      "minLength": 1,
      "maxLength": 240,
      "pattern": "^\\.ciw-build-inputs/[A-Za-z0-9][A-Za-z0-9._-]{0,127}(?:/[A-Za-z0-9][A-Za-z0-9._-]{0,127}){0,6}$"
    },
    "baseLock": {
      "type": "object",
      "additionalProperties": false,
      "required": [
        "stage_id",
        "from_ordinal",
        "stage_marker",
        "kind",
        "declared_reference",
        "dockerfile_platform",
        "platforms",
        "platform_identities"
      ],
      "properties": {
        "stage_id": {
          "$ref": "#/$defs/safeId"
        },
        "from_ordinal": {
          "type": "integer",
          "minimum": 1,
          "maximum": 64
        },
        "stage_marker": {
          "enum": [
            "intermediate",
            "final"
          ]
        },
        "kind": {
          "enum": [
            "scratch",
            "external"
          ]
        },
        "declared_reference": {
          "type": "string",
          "minLength": 1,
          "maxLength": 512
        },
        "dockerfile_platform": {
          "oneOf": [
            {
              "type": "null"
            },
            {
              "$ref": "#/$defs/platform"
            }
          ]
        },
        "platforms": {
          "$ref": "#/$defs/platforms"
        },
        "platform_identities": {
          "type": "array",
          "maxItems": 2,
          "items": {
            "$ref": "#/$defs/platformIdentity"
          }
        }
      },
      "allOf": [
        {
          "if": {
            "properties": {
              "kind": {
                "const": "scratch"
              }
            }
          },
          "then": {
            "properties": {
              "declared_reference": {
                "const": "scratch"
              },
              "platform_identities": {
                "maxItems": 0
              }
            }
          }
        },
        {
          "if": {
            "properties": {
              "kind": {
                "const": "external"
              }
            }
          },
          "then": {
            "properties": {
              "declared_reference": {
                "pattern": "^[a-z0-9](?:[a-z0-9.-]*[a-z0-9])?/[a-z0-9]+(?:[._-][a-z0-9]+)*(?:/[a-z0-9]+(?:[._-][a-z0-9]+)*)*(?::[A-Za-z0-9_][A-Za-z0-9._-]{0,127})?@sha256:[0-9a-f]{64}$"
              },
              "platform_identities": {
                "minItems": 1
              }
            }
          }
        }
      ]
    },
    "platformIdentity": {
      "type": "object",
      "additionalProperties": false,
      "required": [
        "platform",
        "manifest_digest",
        "config_digest"
      ],
      "properties": {
        "platform": {
          "$ref": "#/$defs/platform"
        },
        "manifest_digest": {
          "type": "string",
          "pattern": "^sha256:[0-9a-f]{64}$"
        },
        "config_digest": {
          "type": "string",
          "pattern": "^sha256:[0-9a-f]{64}$"
        }
      }
    },
    "externalInput": {
      "type": "object",
      "additionalProperties": false,
      "required": [
        "input_id",
        "url",
        "sha256",
        "maximum_bytes",
        "destination"
      ],
      "properties": {
        "input_id": {
          "$ref": "#/$defs/safeId"
        },
        "url": {
          "type": "string",
          "format": "uri",
          "pattern": "^https://",
          "maxLength": 2048
        },
        "sha256": {
          "$ref": "#/$defs/sha256"
        },
        "maximum_bytes": {
          "type": "integer",
          "minimum": 1,
          "maximum": 1073741824
        },
        "destination": {
          "$ref": "#/$defs/relativePath"
        }
      }
    }
  }
}
