{
  "schema_version": 1,
  "lock_version": "1.0.0",
  "product_id": "ciw-runner-images",
  "target_id": "runner-mobile",
  "input_policy_id": "runner-image-public-v1",
  "platforms": ["linux/amd64"],
  "bases": [
    {
      "stage_id": "build-tools",
      "from_ordinal": 1,
      "stage_marker": "intermediate",
      "kind": "external",
      "declared_reference": "docker.io/library/gcc@sha256:486d5379b2d679f18bca957901d628952aa0ebc2d82817047bbef1dbfbc13d70",
      "dockerfile_platform": null,
      "platforms": ["linux/amd64"],
      "platform_identities": [{"platform":"linux/amd64","manifest_digest":"sha256:11a6bb72b7ca3e5bd8023c0c03b4addc0a7b24da7a028cc2aa84614efe49f18c","config_digest":"sha256:346a1f1c7cb0a0900f509b64ff29b595c6193750b59df9c9f86332a2857dd47f"}]
    },
    {
      "stage_id": "java-runtime",
      "from_ordinal": 2,
      "stage_marker": "intermediate",
      "kind": "external",
      "declared_reference": "docker.io/library/eclipse-temurin@sha256:3eb81ed94d8c1a34422f19f8188548bdf02cae69c91d0328afdbb7abed90f617",
      "dockerfile_platform": null,
      "platforms": ["linux/amd64"],
      "platform_identities": [{"platform":"linux/amd64","manifest_digest":"sha256:76dfe92b7a1af973928c04cf9be0d682120d88ece81a830755e093d062222309","config_digest":"sha256:ce6b1352bd258fd773252f8ea62799629c12e32d70124fe8b3b665dc0104b0d1"}]
    },
    {
      "stage_id": "node-runtime",
      "from_ordinal": 3,
      "stage_marker": "intermediate",
      "kind": "external",
      "declared_reference": "docker.io/library/node@sha256:0711b541c1c33a8a530ac4f0d391baa9a15b3d804695b1b24a47daa5fb60e74d",
      "dockerfile_platform": null,
      "platforms": ["linux/amd64"],
      "platform_identities": [{"platform":"linux/amd64","manifest_digest":"sha256:f2925910482dc53394bc0034c5f4abffcd01de400794c050ca343fe0d733b486","config_digest":"sha256:baa0de81b831420deb6cce9058048718cbd8fed632048e8552551c8bc36cde4e"}]
    },
    {
      "stage_id": "final",
      "from_ordinal": 4,
      "stage_marker": "final",
      "kind": "external",
      "declared_reference": "docker.io/library/python@sha256:0bdd92d1210a488ce24366c2e1d3b2390e923dcd70a0ce2f673b6f1ce090f556",
      "dockerfile_platform": null,
      "platforms": ["linux/amd64"],
      "platform_identities": [{"platform":"linux/amd64","manifest_digest":"sha256:876416ecde9aca2bcc90e1fb0c7a9500bbf749f5788b70f82d4c5a5c2357f8b4","config_digest":"sha256:613c5454f914638dc2bfcab71c8630de0089f7ebff0a7239b54f34866c4b6051"}]
    }
  ],
  "external_inputs": [
    {"input_id":"actions-runner-linux-amd64","url":"https://github.com/actions/runner/releases/download/v2.336.0/actions-runner-linux-x64-2.336.0.tar.gz","sha256":"04cf0be1aff4c3ec3554466c39124ca250e3effd8873bb7e8d68535aa9505d5d","maximum_bytes":268435456,"destination":".ciw-build-inputs/actions-runner-linux-x64-2.336.0.tar.gz"},
    {"input_id":"flutter-linux-amd64","url":"https://storage.googleapis.com/flutter_infra_release/releases/stable/linux/flutter_linux_3.44.8-stable.tar.xz","sha256":"672089e001571a9fbb209a495c583580c0c6c73ef98999264ba07fa93ace332d","maximum_bytes":1073741824,"destination":".ciw-build-inputs/flutter-3.44.8-linux-amd64.tar.xz"},
    {"input_id":"android-command-line-tools-linux","url":"https://dl.google.com/android/repository/commandlinetools-linux-15859902_latest.zip","sha256":"4e4c464f145a7512b57d088ac6c278c03c9eea610886b35a5e0804e74eedf583","maximum_bytes":268435456,"destination":".ciw-build-inputs/android-command-line-tools-15859902-linux.zip"},
    {"input_id":"android-platform-tools-linux","url":"https://dl.google.com/android/repository/platform-tools_r36.0.0-linux.zip","sha256":"0ead642c943ffe79701fccca8f5f1c69c4ce4f43df2eefee553f6ccb27cbfbe8","maximum_bytes":16777216,"destination":".ciw-build-inputs/android-platform-tools-36.0.0-linux.zip"},
    {"input_id":"android-platform-36","url":"https://dl.google.com/android/repository/platform-36_r02.zip","sha256":"37607369a28c5b640b3a7998868d45898ebcb777565a0e85f9acf36f29631d2e","maximum_bytes":100663296,"destination":".ciw-build-inputs/android-platform-36-r02.zip"},
    {"input_id":"android-platform-37","url":"https://dl.google.com/android/repository/platform-37.0_r01.zip","sha256":"19bdcf42de0cb0e9500a27da6833fc30cdd49a7ec690aa5cabaa0ef893af9ebe","maximum_bytes":100663296,"destination":".ciw-build-inputs/android-platform-37.0-r01.zip"},
    {"input_id":"android-build-tools-36-linux","url":"https://dl.google.com/android/repository/build-tools_r36_linux.zip","sha256":"5d9ac77fb6ff43d9da518a337b4fcf8f9097113df531d99ccefe80ef7ce8250b","maximum_bytes":100663296,"destination":".ciw-build-inputs/android-build-tools-36.0.0-linux.zip"},
    {"input_id":"android-build-tools-37-linux","url":"https://dl.google.com/android/repository/build-tools_r37_linux.zip","sha256":"01af179347cbcd9c208b7f8171f7b21f6dd1d2f85bcd15e88caa51d5d7b86060","maximum_bytes":100663296,"destination":".ciw-build-inputs/android-build-tools-37.0.0-linux.zip"},
    {"input_id":"android-ndk-r28c-linux","url":"https://dl.google.com/android/repository/android-ndk-r28c-linux.zip","sha256":"dfb20d396df28ca02a8c708314b814a4d961dc9074f9a161932746f815aa552f","maximum_bytes":805306368,"destination":".ciw-build-inputs/android-ndk-r28c-linux.zip"}
  ]
}
