{
  "schema_version": 1,
  "lock_version": "1.0.0",
  "product_id": "ciw-runner-images",
  "target_id": "runner-general",
  "input_policy_id": "runner-image-public-v1",
  "platforms": ["linux/amd64"],
  "bases": [
    {
      "stage_id": "build-tools",
      "from_ordinal": 1,
      "stage_marker": "intermediate",
      "kind": "external",
      "declared_reference": "docker.io/library/buildpack-deps@sha256:3c55df66bea98808f842d6d59aa498012888f4cf82874c4a7f2b3a42a2c9c82e",
      "dockerfile_platform": null,
      "platforms": ["linux/amd64"],
      "platform_identities": [
        {
          "platform": "linux/amd64",
          "manifest_digest": "sha256:2dd5264c3672c90da4143369e013d5b3528dd0457863f9306c47ce4c7aea8f05",
          "config_digest": "sha256:2e2ae4c4b458dead3aa12dd362471fd4e973ac2b9de0dd7cb5479ac854ef0267"
        }
      ]
    },
    {
      "stage_id": "node-runtime",
      "from_ordinal": 2,
      "stage_marker": "intermediate",
      "kind": "external",
      "declared_reference": "docker.io/library/node@sha256:0711b541c1c33a8a530ac4f0d391baa9a15b3d804695b1b24a47daa5fb60e74d",
      "dockerfile_platform": null,
      "platforms": ["linux/amd64"],
      "platform_identities": [
        {
          "platform": "linux/amd64",
          "manifest_digest": "sha256:f2925910482dc53394bc0034c5f4abffcd01de400794c050ca343fe0d733b486",
          "config_digest": "sha256:baa0de81b831420deb6cce9058048718cbd8fed632048e8552551c8bc36cde4e"
        }
      ]
    },
    {
      "stage_id": "final",
      "from_ordinal": 3,
      "stage_marker": "final",
      "kind": "external",
      "declared_reference": "docker.io/library/python@sha256:0bdd92d1210a488ce24366c2e1d3b2390e923dcd70a0ce2f673b6f1ce090f556",
      "dockerfile_platform": null,
      "platforms": ["linux/amd64"],
      "platform_identities": [
        {
          "platform": "linux/amd64",
          "manifest_digest": "sha256:876416ecde9aca2bcc90e1fb0c7a9500bbf749f5788b70f82d4c5a5c2357f8b4",
          "config_digest": "sha256:613c5454f914638dc2bfcab71c8630de0089f7ebff0a7239b54f34866c4b6051"
        }
      ]
    }
  ],
  "external_inputs": [
    {
      "input_id": "actions-runner-linux-amd64",
      "url": "https://github.com/actions/runner/releases/download/v2.336.0/actions-runner-linux-x64-2.336.0.tar.gz",
      "sha256": "04cf0be1aff4c3ec3554466c39124ca250e3effd8873bb7e8d68535aa9505d5d",
      "maximum_bytes": 268435456,
      "destination": ".ciw-build-inputs/actions-runner-linux-x64-2.336.0.tar.gz"
    },
    {
      "input_id": "zstd-source",
      "url": "https://github.com/facebook/zstd/releases/download/v1.5.7/zstd-1.5.7.tar.gz",
      "sha256": "eb33e51f49a15e023950cd7825ca74a4a2b43db8354825ac24fc1b7ee09e6fa3",
      "maximum_bytes": 4194304,
      "destination": ".ciw-build-inputs/zstd-1.5.7.tar.gz"
    },
    {
      "input_id": "jq-linux-amd64",
      "url": "https://github.com/jqlang/jq/releases/download/jq-1.8.2/jq-linux-amd64",
      "sha256": "b1c22172dd303f3be49e935aa56aa48a8b7a46e0bc838b4997d3bb451495870f",
      "maximum_bytes": 4194304,
      "destination": ".ciw-build-inputs/jq-1.8.2-linux-amd64"
    },
    {
      "input_id": "yq-linux-amd64",
      "url": "https://github.com/mikefarah/yq/releases/download/v4.53.3/yq_linux_amd64",
      "sha256": "fa52a4e758c63d38299163fbdd1edfb4c4963247918bf9c1c5d31d84789eded4",
      "maximum_bytes": 20971520,
      "destination": ".ciw-build-inputs/yq-4.53.3-linux-amd64"
    },
    {
      "input_id": "kubectl-linux-amd64",
      "url": "https://dl.k8s.io/release/v1.36.2/bin/linux/amd64/kubectl",
      "sha256": "1e9045ec32bea85da43de85f0065358529ea7c7a152eca78154fba5b58c27d82",
      "maximum_bytes": 104857600,
      "destination": ".ciw-build-inputs/kubectl-1.36.2-linux-amd64"
    },
    {
      "input_id": "helm-linux-amd64",
      "url": "https://get.helm.sh/helm-v4.2.4-linux-amd64.tar.gz",
      "sha256": "c306b46f719b0a4da32d0f78ee21bf90ce8d602f15b22ab753f0674d1670a7f3",
      "maximum_bytes": 67108864,
      "destination": ".ciw-build-inputs/helm-4.2.4-linux-amd64.tar.gz"
    },
    {
      "input_id": "kustomize-linux-amd64",
      "url": "https://github.com/kubernetes-sigs/kustomize/releases/download/kustomize/v5.8.1/kustomize_v5.8.1_linux_amd64.tar.gz",
      "sha256": "029a7f0f4e1932c52a0476cf02a0fd855c0bb85694b82c338fc648dcb53a819d",
      "maximum_bytes": 16777216,
      "destination": ".ciw-build-inputs/kustomize-5.8.1-linux-amd64.tar.gz"
    }
  ]
}
