{
  "schema_version": 1,
  "lock_version": "1.0.0",
  "product_id": "runner-flux-control",
  "target_id": "linux-amd64",
  "input_policy_id": "runner-image-public-v1",
  "platforms": ["linux/amd64"],
  "bases": [
    {
      "stage_id": "actions-runner",
      "from_ordinal": 1,
      "stage_marker": "final",
      "kind": "external",
      "declared_reference": "ghcr.io/actions/actions-runner:2.336.0@sha256:0cfdcc701ce933c6d243c6b0b2da767366dc9f2e99961d4c3754b0b78084cdda",
      "dockerfile_platform": null,
      "platforms": ["linux/amd64"],
      "platform_identities": [
        {
          "platform": "linux/amd64",
          "manifest_digest": "sha256:a1919047b038c38871d667c58cfdc7a878452711ab1212fb6036188f27a7ab16",
          "config_digest": "sha256:bd6fe162bb4ab4821daa8d694e20d779865618825d30c94342a0228b89947305"
        }
      ]
    }
  ],
  "external_inputs": [
    {
      "input_id": "flux-linux-amd64",
      "url": "https://github.com/fluxcd/flux2/releases/download/v2.9.4/flux_2.9.4_linux_amd64.tar.gz",
      "sha256": "c2c397a52930f52d2005c01d276116b059d062de379386d58e98115380a766a2",
      "maximum_bytes": 67108864,
      "destination": ".ciw-build-inputs/flux-2.9.4-linux-amd64.tar.gz"
    },
    {
      "input_id": "kubectl-linux-amd64",
      "url": "https://dl.k8s.io/release/v1.34.8/bin/linux/amd64/kubectl",
      "sha256": "f6249132865c13abe3c9dd5038f5da65849cb86eee1608c001831504e481aa8c",
      "maximum_bytes": 67108864,
      "destination": ".ciw-build-inputs/kubectl-1.34.8-linux-amd64"
    },
    {
      "input_id": "yq-linux-amd64",
      "url": "https://github.com/mikefarah/yq/releases/download/v4.53.3/yq_linux_amd64",
      "sha256": "fa52a4e758c63d38299163fbdd1edfb4c4963247918bf9c1c5d31d84789eded4",
      "maximum_bytes": 20971520,
      "destination": ".ciw-build-inputs/yq-4.53.3-linux-amd64"
    },
    {
      "input_id": "helm-linux-amd64",
      "url": "https://get.helm.sh/helm-v4.2.4-linux-amd64.tar.gz",
      "sha256": "c306b46f719b0a4da32d0f78ee21bf90ce8d602f15b22ab753f0674d1670a7f3",
      "maximum_bytes": 67108864,
      "destination": ".ciw-build-inputs/helm-4.2.4-linux-amd64.tar.gz"
    },
    {
      "input_id": "kustomize-linux-amd64",
      "url": "https://github.com/kubernetes-sigs/kustomize/releases/download/kustomize/v5.8.1/kustomize_v5.8.1_linux_amd64.tar.gz",
      "sha256": "029a7f0f4e1932c52a0476cf02a0fd855c0bb85694b82c338fc648dcb53a819d",
      "maximum_bytes": 16777216,
      "destination": ".ciw-build-inputs/kustomize-5.8.1-linux-amd64.tar.gz"
    }
  ]
}
